{
  "attempts": [
    {
      "checkpoint_bytes": 214080440,
      "checkpoints": 1,
      "code_digest_prefix": "a4b7cbd8203f",
      "output_dir": "results/work/texture-repro/convergence-pilot/0d8f2ff0951d-63e6597b835b-a4b7cbd8203f",
      "preserved": true,
      "raw_records": 0,
      "status": "superseded_after_step10_metadata_receipt_failure"
    },
    {
      "checkpoint_bytes": 6347558272,
      "checkpoints": 30,
      "code_digest_prefix": "a3ddbc1bace0",
      "output_dir": "results/work/texture-repro/convergence-pilot/0d8f2ff0951d-63e6597b835b-a3ddbc1bace0",
      "preserved": true,
      "raw_records": 30,
      "status": "complete_after_boot_scoped_checkpoint_resumes"
    }
  ],
  "boot_id": "0ca11c34-38ca-4d2c-aa05-091065da66c3",
  "checked_at_utc": "2026-07-22T01:14:12.159993+00:00",
  "final_validation": {
    "checkpoint_errors": 0,
    "observations": "90/90",
    "observations_csv": {
      "bytes": 33500,
      "path": "results/texture_repro/convergence_pilot_observations.csv",
      "sha256": "c44c4554db8cb14d47ffb729a67ffd3364530286850d6b96f594935ae1725b95"
    },
    "optimizer_steps": "6000/6000",
    "progress": {
      "bytes": 12234,
      "path": "results/texture_repro/convergence_pilot_progress.json",
      "sha256": "1af6dac6409b740f45ed1ce121cabf6e56b4e16c13c77379395d788b933adf85"
    },
    "report": {
      "bytes": 31346,
      "path": "results/texture_repro/convergence_pilot.json",
      "sha256": "723cabefa2c73f27cf020623b7f383a9b132d4fc42d6812ca9590d0f33f1f524"
    },
    "result_errors": 0,
    "trajectories": "30/30"
  },
  "process_identity_fields": [
    "boot_id",
    "start_time_ticks",
    "command_sha256"
  ],
  "process_reconciliation": {
    "active_related_processes": 0,
    "active_workers": 0,
    "cause_of_unreceipted_stops": "undetermined_no_python_exception_or_kernel_log_access",
    "completed_workers": 4,
    "interrupted_shards_resumed": [
      0,
      1
    ]
  },
  "safety": {
    "full_table2_optimizer_steps": 71280000,
    "full_table2_run_launched": false,
    "recommendation_promoted": false,
    "unreceipted_work_possible": true,
    "verified_pilot_optimizer_steps": 6000
  },
  "schema": "peps.texture_convergence_pilot_recovery",
  "schema_version": 1
}
